bank,Title,entryDate,PX_LAST,Label,Articles
Wells Fargo,Banking &amp; Finance: Ruling Bolsters Miami Suits," May 2, 2017",118.77,0,"WASHINGTON -- The Supreme Court handed a partial victory to the city of Miami Monday, ruling it was authorized to bring lawsuits alleging Bank of America Corp. and Wells Fargo & Co. engaged in financial-crisis-era discriminatory lending that led to urban blight and falling property values.The court said in its 5-3 ruling, however, that Miami in future proceedings will have to establish that the banks caused direct harm to the city -- not attenuated, downstream effects -- a high standard that could prove challenging to meet.The court's opinion, written by Justice Stephen Breyer, concluded that Miami had legal standing to bring the lawsuits under the Fair Housing Act, which bars discrimination in housing sales and rentals, as well as in related real-estate transactions.The court rejected the banks' argument that the city wasn't an appropriate party to bring a claim under the law. Miami's alleged economic injuries ""fall within the zone of interests that the FHA protects,"" Justice Breyer wrote.Miami is one of several major cities that have brought similar claims against mortgage lenders. The municipalities are suggesting that discriminatory housing policies by banks can harm not only homeowners and buyers, but also cities themselves, given the high foreclosure rates, blight and urban decay that can follow. The court's ruling Monday found that this theory is legally plausible.The Supreme Court ruling sends the case back to the 11th U.S. Circuit Court of Appeals in Atlanta to review whether the banks' alleged misconduct has a ""direct relation"" to the injuries the city alleges.Miami City Attorney Victoria Mendez said she was ""extremely pleased"" with the ruling and looked forward to additional court proceedings.A Bank of America spokesman said the company ""is committed to the goals and intent of the Fair Housing Act"" but added, ""We believe these claims are without merit and we will continue to defend our interests in this matter."" Wells Fargo said the Supreme Court announced stringent standards, and it ""will be very difficult for Miami or any other municipality to show the required connection between the claimed damages and unsubstantiated allegations about our lending practices, which do not reflect how we operate in the communities we serve.""The ruling produced a rarely seen coalition at the court, with conservative Chief Justice John Roberts joining the court's four liberals to form a five-justice majority. That lineup has occurred only a handful of times in the chief's 12-year tenure, most notably in the court's 2012 ruling that saved President Barack Obama's health-care law.Credit: By Brent Kendall and Jess Bravin"
Wells Fargo,Squeeze on Car Loans Deepens Sales Drop --- By AnnaMaria Andriotis and Christina Rexrode," May 4, 2017",114.98,0,"Wells Fargo & Co. has spent roughly nine months working to reform the sales culture that led to a $185 million fine, public humiliation and the departure of its chief executive. Now, the bank is confrontinga new challenge: growing again.So far, the San Francisco-based lender has focused on cutting costs and urging investors to be patient, though shareholders, analysts and some employees question how the bank will match its past performance without the sales tactics that got it in trouble.Complicating the bank's challenge are broader factors including low interest rates and a sluggish U.S. economy. ""If you turn the clock back 10 years ago, we were in an environment where the economy was growing more quickly and revenues, candidly, were a little bit easier to come by,"" Chief Executive Timothy Sloan said during an investor conference last week.Wells Fargo was fined $185 million in September by regulators for opening as many as 2.1 million accounts that used fictitious or unauthorized customer information. The bank and regulators disclosed then that the bank had fired 5,300 employees over five years for improper behavior including opening up accounts for customers without their knowledge.Since the fall, the bank's revenue growth has slipped for the first time in years. Its shares are the worst performing of the four biggest U.S. banks both year to date and since the November election.Asked about growth, a Wells Fargo spokeswoman noted the bank's diversified business model and strong, steady results as well as opportunities in its wholesale, wealth and investment management, and consumer businesses.Getting the retail division right is crucial for Mr. Sloan and other Wells Fargo executives. It sits in the bank's community banking unit, which last year accounted for more than 50% of Wells Fargo's overall net income.Wells Fargo's return on equity, a key measure of profitability, was down to 11.5% last quarter from its recent high above 14% in 2014.Even as it contends with broader economic trends affecting all banks, Wells Fargo must address lingering and potentially distracting impacts of the scandal.Agreements with regulators have put the bank in a less likely position to ask for approval on certain deals it would have pursued in the past.In December, the bank was sanctioned by U.S. regulators over its ""living will"" contingency plan, required of all banks, on how it would avoid a taxpayer bailout if it were about to go bankrupt. In March, it was downgraded on its ability and willingness to serve lower-income populations. The bank later passed the living-will test, and it is cooperating with other investigations.As it moves ahead, Wells Fargo has many among its 75,000 retail-bank employees who feel hamstrung by the company's new way of doing business. The bank eliminated product sales goals, concluding they had been emphasized too much and led employees to use questionable tactics to meet their numbers.A new incentive-compensation system this year seeks to change the orientation of the retail division from lofty product-sales goals to a focus on customers' overall satisfaction.Questions, however, persisted about the new strategy and growth during the bank's investor day last month.""It seems like a lot of what you're saying over retail strategy is pretty ambitious, and it seems like there's a fundamental tension between a lot of what you're trying to do,"" UBS Securities LLC analyst Saul Martinez said during the investor day.Mary Mack, the executive in charge of Wells Fargo's retail branches, responded to Mr. Martinez that there is ""alignment"" between the business changes she has enacted and the bank's growth plans. She also told analysts Wells Fargo was increasing its ""loans, deposits and investments.""She is also focused on shifting the bank's culture through manager training this summer and recent executive shuffling in her unit.""We have to help people continue to get comfortable with the change and create clarity"" for employees, she said in a recent interview.In preparing for certain reviews recently, a bank finance manager advised some regional executives they should be prepared for conversations with Ms. Mack to shift from seeking stability postscandal ""to growth and strategies around spurring growth,"" according to an April email reviewed by The Wall Street Journal.Yet some employees have expressed concern it isn't clear how to drive new business absent the bank's prior emphasis on product sales. One executive said questions among employees include: ""How am I going to grow the business . . . with these constraints? How do I do it in a way that doesn't appear to be sales pressure?""Meanwhile, Wells Fargo's numbers are falling. In March, the most recent data available, consumer checking-account openings at Wells Fargo fell 35% and credit-card applications dropped 42% from a year earlier.While the decline is less severe than seen soon after the September announcement, bank executives said last week that they don't expect the credit-card business to bounce back for a few quarters."
Wells Fargo,"MANSION --- Luxury House on the Prairie --- Sioux Falls, S.D., fueled by rapid growth, sees a boom in high-end homes; eschewing the 'oak everything' look"," May 5, 2017",115.19,1,"Morgan Stanley will soon prevent its clients from buying Vanguard Group's mutual funds, the latest big Wall Street brokerage to mostly shut out some of the index giant's funds.Starting next week, Morgan Stanley brokers will no longer be able to sell their clients new positions in Vanguard mutual funds, including its popular index offerings, the bank confirmed. Merrill Lynch, meanwhile, already doesn't allow new clients to purchase new shares of Vanguard's mutual funds, said Merrill brokers familiar with the matter, adding that it has been a longstanding policy of the Bank of America Corp.-owned brokerage.The brokerage arms of Wells Fargo & Co. and UBS Group AG, two of the other big traditional brokerages, haven't dropped Vanguard's funds, people familiar with their sales practices said.The restrictions come as Vanguard has boomed amid investors' embrace of funds that mimic broad indexes for a fraction of the cost of actively managed funds.The Malvern, Pa., firm brought in $289 billion last year, or 54%, of the $533 billion that flowed into all mutual funds and exchange-traded funds, according to research firm Morningstar Inc.Michael Wong, a wealth-management researcher with Morningstar, said he was surprised by the Morgan Stanley move. ""Vanguard, among the fund world, is a household name, so I would assume there would be some client demand for it,"" he said.Morgan Stanley, which oversees $2.2 trillion of client assets, says Vanguard's funds are unpopular with its clients. Vanguard's mutual funds represented less than 5% of Morgan Stanley's total mutual-fund assets, said bank spokesman Bruce Dunbar.Morgan Stanley clients currently invested in Vanguard mutual funds won't be forced to sell, and they can add to those positions through early next year. The brokerage will continue to offer Vanguard exchange-traded funds, said Mr. Dunbar.Vanguard is unusual among fund firms because it has a policy of not paying other firms to sell its funds. Many fund firms have long paid for shelf space on platforms or had revenue-sharing agreements with brokerages.A spokeswoman for Vanguard said, ""We share in the disappointment of advisers who are not able to access conventional shares of our mutual funds,"" adding that Vanguard doesn't pay any brokerage firm or its advisers for the distribution of its funds.Merrill, meanwhile, has for some time restricted the sale of new shares of Vanguard mutual funds to clients who don't have an existing position, said Merrill brokers familiar with the matter. Clients who come to the firm with existing positions can add to those, as long as they have research coverage by Merrill's chief investment office or a Morningstar analyst, they added.As at Morgan Stanley, Merrill Lynch's ban on buying Vanguard mutual funds doesn't apply to Vanguard ETFs. And investors who direct their own investments through Merrill Edge, Bank of America's self-service investment platform, can buy Vanguard mutual funds and ETFs without restrictions.Brokers at both firms say they usually favor ETFs, including Vanguard's, for investors who want a passive investment strategy because they tend to be cheaper and more tax efficient than mutual funds.Morgan Stanley, which has more than 15,000 brokers, said it is removing the Vanguard funds as part of a broader overhaul of its mutual-fund offerings.Over the past several months, the firm has been cutting 25% of funds it deems less popular or underperforming, a process it kicked off to help it comply with the Labor Department's fiduciary rule requiring brokers to act in the best interest of retirement savers.AdvisorHub earlier reported Morgan Stanley's removal of Vanguard funds."
Wells Fargo,Business News: Morgan Stanley to Drop Vanguard From Offerings," May 5, 2017",114.71,0,"Bank of America Corp. is the stingiest of the big U.S. banks. But its depositors don't seem to care.Last year, the bank paid an average of 0.08% for its interest-bearing deposits in the U.S. That was around half the rate paid by J.P. Morgan Chase & Co. or Wells Fargo & Co. and a fraction of what firms such as Goldman Sachs Group Inc. and Ally Financial Inc. paid.Yet Bank of America kept raking in customers' money. Such deposits increased $33 billion over 2015.Bank of America's ability to keep paying next to nothing highlights the built-in advantages of big banks as well as changes in consumer attitudes toward deposits. For investors, it indicates some banks may be able to increase rates more slowly than in past Federal Reserve rate-raising cycles, bolstering profits.Indeed, Bank of America's low deposit costs helped boost its profit margins and played a part in pushing the bank to a 40% first-quarter profit increase from a year earlier.While the Federal Reserve raised rates again in the quarter, the trend didn't change for Bank of America. Its average cost of U.S. interest-bearing deposits was just 0.09% and deposits in its consumer-banking business increased by a further $29 billion from the fourth quarter, according to the bank's quarterly earnings presentation.By holding the line on deposits, Bank of America gains a competitive advantage. Consider that it paid $617 million for about $796 billion in U.S. interest-bearing deposits in 2016, according to bank regulatory filings, far less than what J.P. Morgan and Wells Fargo paid for only a bit more in funds.And Bank of America's interest payout came in below Goldman's $828 million expense or the $822 million Ally forked out -- even though those banks have just $115 billion and $79 billion of deposits, respectively.Consumers clearly could make more by putting their money elsewhere. Had Bank of America customers moved all their money to J.P. Morgan, they would have made $700 million more at its average deposit-cost rate. Move it all to Goldman and they would have pocketed $5.1 billion more.That they haven't moved money elsewhere speaks to the stickiness of deposits. It also bolsters a central argument by banks in the face of calls they should be broken up: Customers value their breadth and the different services they offer.Bank of America, for example, had 4,559 branches in the U.S. and 15,939 ATMs at the end of the first quarter.Goldman Sachs Bank USA, on the other hand, has no ATMs and retail customers can't walk into a Goldman branch.Indeed, depositors place a premium on convenience, like being able to access thousands of ATMs or transfer money using their smartphones.Abby Trexler of New York has kept savings and checking accounts at J.P. Morgan Chase for more than a decade and says she has no plans to move them to a higher-yielding account. A number of years ago, she had an account with an online bank and found it cumbersome to get money in and out.Ms. Trexler, who is in her mid-30s and works in communications, likes Chase's ubiquitous ATMs and mobile technology. For instance, she and her sisters used the bank's payments feature to split the cost of their parents' Christmas gifts last year.""There are people like me willing to give up a little bit,"" Ms. Trexler said. ""It just seems like such a hassle to not be able to walk in on every corner and get done what I need to get done.""Younger consumers also prefer the largest U.S. banks because they think their technology is better, said Jim Miller, senior director at market-research firm J.D. Power. Customers under 40 give the bigger banks higher satisfaction marks for things like mobile banking. This age group is particularly important to keep happy because they are five times more likely to switch banks than older customers, according to J.D. Power research.Another factor working in the big banks' favor: They serve a lot of depositors with small accounts. For those savers, gains from switching to a higher-yielding account typically aren't worth the hassle, especially in an age of superlow rates.Say a depositor has $3,000 in a standard Bank of America savings account. On the face of it, that person could gain a lot by moving from such an account, which typically pays about 0.01%, to GS Bank, which offers a savings account with a 1.05% yield.The practical impact is far smaller: The gain from switching, over a year, would only be around $31."
Wells Fargo,"Stingy Banks Pull In Depositors --- Bank of America pays lower rates than rivals, but its services attract a stream of money"," May 9, 2017",114.68,0,"Wells Fargo & Co. is investigating whether three senior executives in Chicago inappropriately steered business toward certain individuals in its private-banking unit, according to people familiar with the matter. The probe comes months after the bank reached a settlement over a sales-practice scandal in its retail unit.Two weeks ago, Wells Fargo suspended Chip Flannagan, a senior vice president and regional managing director for the bank's Chicago private-banking operations, according to the people. Wells Fargo also suspended two other private-banking executives as part of its investigation: senior vice presidents Scott Landau and J. Scott Voigt.Wells Fargo declined to make Messrs. Flannagan, Landau and Voigt available to comment. Messrs. Flannagan and Landau didn't return phone calls seeking comment, while Mr. Voigt couldn't be reached.The investigation is looking into whether Messrs. Flannagan, Landau and Voigt steered Wells Fargo clients toward certain individuals within Wells Fargo's private-banking unit and away from other employees, such as brokers, who may have been better equipped to handle certain client needs, the people said.The bank's concern is that in some cases the expectation to meet growth goals within the private-banking unit may have taken precedence over the needs of clients, the people said. Meeting such goals also allowed certain employees to collect bonuses, the people said. It wasn't clear if any clients were harmed by the alleged actions, the people said.A Wells Fargo spokeswoman said the allegations ""deserve serious attention, and they are receiving it."" She said the investigation is continuing. ""We owe it to all parties involved to let the process proceed in a way that guarantees a fair and thorough outcome,"" she said.The alleged practices, which aren't related to the bank's sales-practice scandal in which it agreed to pay a $185 million settlement in September, had been occurring in the bank's Chicago wealth-management branch for some time and don't appear to include other regions, the people said."
Wells Fargo,Wells Investigates Whether Executives Steered Business," May 11, 2017",115.51,1,"In the first episode, Martin complains that Nan isn't paying enough attention to him. She's ignoring his needs and taking him for granted. While acknowledging that these are ""first-world problems,"" he stares into the camera and says, ""I just think we have a little work to do.""Another romantic comedy about busy millennials trying to make love work? Not exactly. Martin is a dog and Nan is his owner. And, yes, Martin talks -- to himself anyway.Premiering May 17 on ABC, ""Downward Dog"" is about a self-obsessed, somewhat melancholy mutt with thoughts viewers can hear and a distracted but loving owner. The series took an unusual route to its television debut, starting as web series made for laughs for friends and ending up debuting at the Sundance Film Festival.The show has generated buzz from the web series and four episodes of the ABC series that were screened at Sundance. ""I had genuine love and affection for it right out of the gate,"" said ABC Entertainment President Channing Dungey.Creators Samm Hodges and Michael Killen didn't have grand ambitions for ""Downward Dog"" when they started making webisodes to pass the time between shooting commercials at Mr. Killen's Pittsburgh-based production and visual-effects company Animal Inc.""It was just for fun,"" said the 33-year-old Mr. Killen, who helped develop Taco Bell's talking Chihuahua commercials.The webisodes caught the eye of manager Jimmy Miller, whose clients include Judd Apatow. Mr. Miller signed the duo and struck a deal with television and movie production company Legendary Entertainment. He started setting up meetings with networks and streaming services, much to the surprise of Messrs. Hodges and Killen.""We never wrote the web series to be a TV show,"" said Mr. Hodges, 32, adding, ""It's challenging to write for a protagonist with no thumbs that can't do anything.""The web series, where episodes ran only a few minutes, focused primarily on the dog and his owner. For a TV show, the pair added an on-again, off-again love interest for Nan as well as a job as a creative director in an advertising agency, ensuring that the show would be more than just Martin's deep thoughts.""The dog is a lens for human life,"" said Mr. Hodges, who also voices Martin's inner dialogue.HBO, Showtime and Amazon Prime expressed interest but Mr. Miller also wanted to shop it to broadcast networks. That seemed a longshot to Messrs. Hodges and Killen since the character of Martin wasn't being played for laughs and hijinks. The dog doesn't ride a skateboard, drive a car or prance around on two legs.""It was an interesting new way in presenting a talking dog with a lot of personal angst, something a commercial entity wouldn't necessarily want,"" Mr. Killen said. Ned, the dog who plays Martin in the ABC series, is a rescue animal with such distinctive eyes and appearance, the producers can't turn to a backup dog to stand in for Ned in any scenes.ABC ended up aggressively bidding for the project and although the two executives who had championed acquiring it -- Entertainment President Paul Lee and comedy head Samie Falvey -- subsequently left the network, it found new supporters in Ms. Dungey and Ben Sherwood, president of Walt Disney Co.'s Disney/ABC TV unit.""The 'Downward Dog' pilot stood out as an incredibly heartfelt, emotionally true and memorable piece of television,"" Mr. Sherwood said. ""It feels different from the start and not just because there is a thinking dog in it.""Mr. Sherwood wouldn't predict if the show will click with viewers but noted, ""there are 70 million to 80 million dogs in the U.S. and we hope they're watching with their owners.""Convincing an actor to co-star with a dog was no easy task. Allison Tolman, best known for her portrayal of Molly in season one of the FX drama ""Fargo,"" questioned her agent's sanity when she heard the pitch.""I was like, 'What, are we that desperate that we're looking at talking dog shows?' "" recalled Ms. Tolman, who plays Nan. ""My first reaction was not great, that's for sure.""After reading the script and watching the episodes online she was sold, in part because the show felt so real.""This is a really big sell that this dog can talk so everything else has to be super realistic and very natural,"" Ms. Tolman said.She has bonded with Ned but will only go so far for her co-star. Cleaning up after him, she said, ""is definitely not in my contract."""
