T5,27-Feb-18,"Advertisement By TIFFANY HSUFEB. 27, 2018
 Judith Pearson’s home in rural Minnesota is stocked with guns for hunting and recreational use, but that didn’t stop her from venting her frustration with the National Rifle Association after the deadly school shooting in Parkland, Fla. Ms. Pearson, a retired school principal, was irked by the group’s repeated efforts to preserve civilian access to semiautomatic rifles, like the AR-15 the gunman used to kill 17 students and school staff members. “BoycottNRA,” she wrote to her handful of Twitter followers on the day of the attack, becoming one of the first participants in what became a sprawling campaign to force corporate America to dissociate itself from the gun lobby. Across the country, in Los Angeles, Laura Mannino had a similar thought. Drain the NRA, an advocacy group she co-founded in October after a deadly shooting in Las Vegas, developed a public spreadsheet of businesses associated with the gun group. After the attack in Florida, Ms. Mannino helped organize a rally against gun violence in downtown Los Angeles that drew hundreds of people. “Everyone started, in parallel ways, but in tandem, to go after these companies,” she said. Since the Parkland massacre, a range of people and coalitions have converged on the nationwide battleground over gun control. That includes individuals trying to make a statement, activist organizations sensing a shift in sentiment, informal parents’ clubs, marketing executives, niche media groups, celebrities and shooting survivors. Advertisement Through an uncoordinated but simpatico collection of Twitter hashtags, retweeted lists, Facebook groups, online petitions and carefully orchestrated campaigns, the protest has pushed a major bank, several car rental companies, two airlines and other businesses to publicly cut ties with the N.R.A. Advertisement On Monday night, the insurance broker Lockton Affinity was the latest to join a list of more than a dozen companies that includes the insurance provider MetLife, the cybersecurity firm Symantec, and the automobile pricing and information website TrueCar. Unlike hundreds of other boycotts that barely registered with consumers, the current effort has “taken on significant symbolic purpose” and speed, said Lawrence B. Glickman, a history professor and boycotts expert at Cornell University. “This wasn’t a concerted thing — it just took off and took on a life of its own,” Professor Glickman said. “It’s stunning — nothing like this has ever happened before with the N.R.A. as far as I know.” The #BoycottNRA hashtag, the unofficial unifier of the movement, was trending on Twitter on Friday and appeared more than 10,000 times in a single four-hour period on Monday, according to the analytics service ExportTweet. The hashtag has floated around social media since before the Sandy Hook massacre in late 2012, usually bubbling up after high-profile mass shootings only to quickly fade after failing to inspire much action. After the shooting at Marjory Stoneman Douglas High School in Florida on Feb. 14, two dozen tweets mentioned the hashtag, followed by three dozen more the next day. But the calls for a boycott remained vague until last week, when lists of companies linked to the N.R.A. began tearing across social media. Posts from popular accounts were retweeted thousands of times. Advertisement ThinkProgress, a news website with a liberal bent, was among the first to spread the names, updating a list on Feb. 20 that it first published after the Sandy Hook shooting. It also published a report that the website for the N.R.A.’s official credit card was down. On Thursday, the First National Bank of Omaha, which issued the credit card, publicly confirmed its break from the N.R.A. “Then the floodgates were open,” said Judd Legum, who founded ThinkProgress. “Lots of people began moving very, very fast.” The pressure on companies to cut ties with the N.R.A. soon began sprouting up from various sources. Students who survived the Parkland shooting, who have become vocal proponents of gun control — and some of whom now have hundreds of thousands of social media followers — began pressuring specific companies to follow the bank’s lead. The massive asset manager BlackRock demanded information about the gun industry’s presence in investment portfolios. There were also calls for banks and payment processing companies to refuse firearms-related transactions.  . Facebook posts and petitions from parents in Brooklyn, hiking enthusiasts and bike shops urged consumers and retailers like REI not to support CamelBak hydration packs and Bell helmets. Those brands are owned by Vista Outdoor, which also makes guns and ammunition. Celebrities including Alyssa Milano and Denis O’Hare began backing a push to stop Amazon and other streaming sites from supporting the NRATV online video channel. Unaware of the Hollywood campaign, Brad Chase, a communications consultant who in the past has worked with some of the brands that distanced themselves from the N.R.A., staged his own protest against Amazon after seeing screen grabs of the N.R.A.’s content streaming on its platforms. He and a longtime friend, whose son survived the Parkland shooting, initiated a petition on Thursday that asked people to “flood Amazon’s Legal Department with calls.” The pair hoped for 5,000 signatures. By Tuesday afternoon, they had more than 200,000. “We know we’re not going to change this epidemic of gun violence overnight, but this is one of those things people can do right now while we wait for the slow wheels of government to take action,” Mr. Chase said. 
                When a gunman walked into a Florida school on Feb. 14, his rifle let him fire in much the same way that many American soldiers and Marines would fire M16 and M4 rifles in combat.             So far, Amazon has not issued any comment related to the N.R.A. Some companies have resisted calls to sever business relationships with the N.R.A. On Monday, FedEx said that while it disagreed with the N.R.A.’s policies on semiautomatic firearms, it would continue to offer discounts to the group’s members. Advertisement The N.R.A. itself has accused companies of “a shameful display of political and civic cowardice” and said that “in time, these brands will be replaced by others.” Since that statement on Saturday, the divisive debate has inspired some gun rights supporters to post about joining the N.R.A., using the hashtag #TweetYourNRAMembership. Many N.R.A. supporters have also vowed not to patronize the brands that ended relationships with the gun group. Still, the boycott effort — parts of it organic, parts of it carefully orchestrated — was an impressive show of force against the gun lobby. Shannon Watts, who founded the activist group Moms Demand Action for Gun Sense in America after the Sandy Hook massacre, said her group had successfully persuaded hundreds of companies like Starbucks to block guns in their stores. The organization has more than 100,000 active volunteers it can quickly mobilize to create graphics, send email blasts and fan out over social media. But after Parkland, Moms Demand Action adopted hashtags that others had created and cheered on campaigns that others had organized. “The more the merrier — it’s been a cumulative effort of different groups within the same space, all putting pressure on the N.R.A.,” Ms. Watts said. “What this has shown is that it doesn’t have to be any one specific group or person — it’s more about the overall noise than any single hashtag.” Follow Tiffany Hsu on Twitter: @tiffkhsu. A version of this article appears in print on February 28, 2018, on Page A12 of the New York edition with the headline: Protests Are Common. The Boycott of the N.R.A. Is Different.  Order Reprints| Today's Paper|Subscribe

 We’re interested in your feedback on this page. Tell us what you think. Go to Home Page »",amazon,reviews are negative,1524.5,1526.78,1507.21,1511.98,4808776
T1,27-Feb-18,"Advertisement By CHAD BRAY and MICHAEL J. de la MERCEDFEB. 27, 2018
 LONDON — Comcast may have found a way to disrupt Walt Disney Company’s plan to buy most of 21st Century Fox: topping Fox’s bid to buy the British satellite broadcaster Sky with its own $31 billion takeover offer. The bid, plans for which were announced on Tuesday, seizes upon 21st Century Fox’s difficulties buying the piece of Sky that it does not already own. British regulators have expressed repeated concerns about giving Rupert Murdoch and his family more control over the country’s media, stretching the approval process out over more than a year and forcing 21st Century Fox to offer more concessions. Comcast has said that buying Sky would help it expand in Europe, where the broadcaster has 23 million customers and owns rights to show the English Premier League and other professional soccer leagues. Disney, too, has been keen on expanding internationally, with the British company serving as an important part of its $52 billion plan to buy a significant portion of 21st Century Fox. Whoever prevails, it will shake up Disney’s plans. Either 21st Century Fox will have to pay more for Sky, or Disney will lose a valuable international property to Comcast. Advertisement In a statement, 21st Century Fox said that it “remains committed to its recommended cash offer for Sky,” which it made in 2016. Advertisement Disney, Comcast and others are rushing to strike major deals in a swiftly changing media landscape. AT&T has bid more than $85 billion to take over Time Warner, a proposed merger that the Justice Department is attempting to block. Consumers increasingly stream their movies and televisions shows over the internet. Upstart technology companies like Apple and Amazon nurture ambitions to rival Hollywood’s big studios. Online broadcasters are even increasingly bidding for the rights to show sports — long a major moneymaking business for traditional broadcasters and cable operators. The saga over Sky has been one of the most drawn out deal-making dramas in media. Mr. Murdoch, the 21st Century Fox executive chairman, has tried for years to take full control of the broadcaster, which he started in 1989. By owning the rest of Sky, 21st Century Fox would be better positioned to take on the likes of Netflix, Amazon and other streaming giants. In 2011, Mr. Murdoch was forced to withdraw a $12 billion offer for the rest of Sky as a firestorm erupted over phone hacking by the news media in Britain. The scandal eventually led to the closing of The News of the World, the first newspaper Mr. Murdoch acquired in Britain in the late 1960s. In December 2016, 21st Century Fox tried again, in an effort to expand its global reach and cement Mr. Murdoch’s legacy. The company agreed to buy the 61 percent of Sky that it does not own for about $16 billion. While the Office of Communications, or Ofcom, ruled in June that Mr. Murdoch and other company executives were “fit and proper” to hold broadcasting licenses in Britain, it also said that the deal warranted more scrutiny. In the regulator’s view, the sexual harassment scandal at Fox News had amounted to “significant corporate failures.” Then last month, Britain’s competition regulator provisionally rejected the deal, saying that it was “not in the public interest.” The regulator said it was concerned that the deal would give the Murdoch family “too much influence over public opinion and the political agenda.” It noted at the time that Murdoch-controlled outlets, which include the newspapers The Sun and The Times of London, were already consumed by nearly a third of Britain’s population. In hopes of winning over regulators, 21st Century Fox has offered to establish a “fully independent” editorial board for Sky News and to continue to fund the Sky News brand after the transaction for at least 10 years. Advertisement 21st Century Fox had hoped to complete the Sky deal before the Disney sale was finalized. But Comcast’s move just adds uncertainty to an already complicated process. Disney, which declined to comment on Comcast’s proposal, must now decide how much it cares about Sky. It is also not clear if Disney would want to end up being partners with Comcast, in the event that Comcast wins majority control of Sky and Disney ultimately has Fox’s 39 percent stake. While announcing the planned purchase of Fox’s entertainment assets in December, Robert A. Iger, Disney’s chief executive, singled out Sky as “a real crown jewel” in a television interview with Bloomberg. “We certainly would be looking forward to the opportunity to have Sky be part of our company,” he said.  . Comcast has circled 21st Century Fox in the past. Last year, the cable giant was in preliminary talks to buy the entertainment assets owned by 21st Century Fox, including the minority stake in Sky. Disney ultimately prevailed. At the very least, Comcast has most likely made it more expensive for 21st Century Fox to buy all of Sky. Under the terms of its proposed bid, Comcast said, it would pay 12.50 pounds, about $17.50, a share in cash. That would represent a premium of 13 percent over its closing price on Monday and is about 16 percent above 21st Century Fox’s current offer of £10.75. On Tuesday, shares of the British broadcaster jumped by nearly one-fifth. The stock surge suggested investors expected 21st Century Fox to back away or come back with an even better offer. Comcast shareholders seemed less pleased. The company’s stock price dropped more than 6 percent in midday trading, to about $37. Disney shares fell 4 percent, to about $105.50, and Fox shares declined 2.6 percent, to about $37.80. An influential media analyst, Craig Moffett, who follows Comcast for MoffettNathanson, wrote in a research note that the Sky offer had positive aspects, including offering Comcast’s entertainment unit, NBCUniversal, broader distribution in Europe. Still, “Comcast will have to twist themselves into knots to explain why satellite distribution won’t be just as obsolete in Europe as it already is in the U.S.,” Mr. Moffett said. “Perhaps worst of all, this morning’s bid doesn’t really put to rest the idea that they might still try a topping bid for Fox’s U.S. assets, including the rest of Sky” if the Justice Department ends up approving AT&T’s takeover of Time Warner. Advertisement “The notion that Comcast might make a topping bid for Fox has weighed heavily on Comcast shares,” he added. For either Comcast or Disney, Sky offers a platform for international expansion. Comcast said in a statement that about a quarter of its revenue would come from international operations should it seal a deal with Sky, up from 9 percent currently. In addition to its other businesses, Sky has also announced plans to start streaming services in Spain and Switzerland. “We look at Sky as a media company: Sky News, Sky Sports, Sky Movies,” Brian L. Roberts, Comcast’s chairman and chief executive, said on a conference call with analysts. “There’s tremendous presence in the content creation, not just the distribution.” In a research note on Tuesday, Polo Tang, a UBS analyst, said that Sky could be “strategically interesting” to a variety of bidders, given its content and its broadcast and streaming distribution network. It also recently retained the rights to the Premier League at a lower cost than analysts had expected. Mr. Tang said that the benign outcome of the Premier League auction potentially “gives Fox scope to raise its offers.” Comcast said it was seeking control of more than half of Sky’s shares with Tuesday’s offer but was ultimately interested in acquiring all of the British broadcaster. In a statement, Sky urged shareholders to take no action yet. The broadcaster added that its independent directors “are mindful of their fiduciary duties and their obligations under the U.K. Takeover Code.” Follow Chad Bray on Twitter: @Chadbray Brooks Barnes contributed reporting from Los Angeles. A version of this article appears in print on February 28, 2018, on Page B1 of the New York edition with the headline: Comcast  Tries Deal To Blunt  Disney Push.  Order Reprints| Today's Paper|Subscribe

 We’re interested in your feedback on this page. Tell us what you think. Go to Home Page »",amazon,reviews are negative,1524.5,1526.78,1507.21,1511.98,4808776
T2,27-Feb-18,"Advertisement By RICHARD FAUSSET and TIFFANY HSUFEB. 27, 2018
 ATLANTA — Delta Air Lines, one of Georgia’s largest private-sector employers, is among the glossiest corporate jewels in the state, contributing billions of dollars a year to the economy. Its hundreds of daily flights in and out of Atlanta’s airport are the main reason Georgia’s capital can brag, with justification, that it is a truly international city. “Delta is the Atlanta international airport, and our airport is, you know, the fuel that generates our commercial community,” said Sam Massell, the city’s former mayor. But prestige, boosterism and corporate coddling — all cherished concepts in Georgia — took a back seat this week to the national debate over gun control. In the wake of the Florida school shooting, the airline announced it was ending a promotional discount with the National Rifle Association, and suddenly found itself in the rare position of being openly dressed down — and potentially punished — by Republicans who control the statehouse. Lt. Gov. Casey Cagle of Georgia, a Republican who presides over the State Senate and has received an A-plus grade from the N.R.A., joined other conservative lawmakers this week in threatening to remove a $50 million sales tax exemption on jet fuel that some hoped would encourage Delta to open even more routes — and help Atlanta attract even more national and international companies. Advertisement The conservative backlash highlighted the challenge confronting corporations around the country that are struggling to cater to both ends of America’s increasingly distant political and cultural poles. Advertisement As pressure from social media and advocacy groups has intensified, and calls for boycotts mount, more than a dozen companies have severed business ties with the N.R.A. since the massacre in Parkland, Fla. Just as quickly, a counteroffensive arose from gun supporters excoriating the companies for their stance, forcing business leaders to navigate the treacherous ground where social responsibility, ideology and financial impact converge. Delta did not respond on Tuesday to Mr. Cagle’s threat or amplify its stance regarding the N.R.A. In a statement over the weekend, the company said its decision to stop offering discounted fares to the N.R.A. “reflects the airline’s neutral status in the current national debate over gun control amid recent school shootings.” As of Tuesday afternoon, the jet-fuel tax break, while opposed by Mr. Cagle and some other conservative Republicans, had not yet been stripped out of a broader Senate tax bill. Delta chose to end special discounts, but FedEx took a different approach, one that highlighted the delicate balancing act. In a statement Monday, FedEx said it disagreed with the N.R.A.’s stance on civilian access to assault rifles but would continue to offer discounts of up to 26 percent to the group’s members. “We are very clear that, when we set pricing strategy or look to adjust pricing, it is not based on political positions or points of view,” Patrick Fitzgerald, the company’s senior vice president, integrated marketing and communications, said in an interview on Tuesday. “But we do have a very clear corporate position in terms of gun safety and school safety.” In Georgia, the debate has been surprisingly fiery, even in a state long defined by tensions between the liberal metropolis and conservative countryside, and between the values of global corporate culture and those of Southern Republicans. “Corporations cannot attack conservatives and expect us not to fight back,” Mr. Cagle, a leading G.O.P. candidate for governor, wrote in a tweet Monday, in which he announced that he would “kill any tax legislation” that benefited Delta unless it changed its position. Advertisement State Senator Josh McKoon said in an interview Tuesday that he was put off by Delta’s assertion that it was trying to remain neutral on the guns issue, when it had taken positions on other social topics in the past. “It just came off as very disingenuous,” Mr. McKoon said of Delta’s statement. Referring to Mr. Cagle’s pushback, Mr. McKoon said, “I think he captured the sentiment and the feeling of a lot of Georgians,” who, he said, were frustrated “with Delta weighing in on an issue that has nothing to do with the topic of transportation, for sure.” But Mr. Massell, the former mayor who is president of the Buckhead Coalition, an influential Atlanta business and civic group, called the entire debate “embarrassing.” He said that he feared the threat against Delta would scare away Amazon, the online retail giant that has listed Atlanta among the finalists for its second headquarters.  . “I don’t believe in blackmail, and I’m sorry to use such a dirty word, but that’s almost what it tastes like,” said Mr. Massell, a Democrat who served as mayor from 1970 to 1974. “That’s terrible. That’s not Georgia’s image. That’s backwoods stuff that doesn’t belong at all.” The story of Delta and the story of Atlanta have been deeply intertwined for decades. The company was founded in Louisiana in the 1920s; it focused, in the earliest days, on crop dusting, in an effort to end the boll weevil infestation that had ruined many Southern cotton crops. The company moved to Atlanta in 1941. In subsequent decades, the city, which was founded as a railroad hub, invested heavily in its airport, and pushed a message that it was more socially tolerant than other Southern cities like Birmingham. It was a winning combination. Today, Hartsfield-Jackson Atlanta International Airport is the busiest in the world, and Delta employs more than 33,000 Georgia residents. 
                When a gunman walked into a Florida school on Feb. 14, his rifle let him fire in much the same way that many American soldiers and Marines would fire M16 and M4 rifles in combat.             Its current problem with the legislature has prompted leaders in other states to woo Delta via Twitter. “You know, in mathematics, Delta represents the change in something,” wrote Randall Woodfin, the mayor of Birmingham. He added, “Let’s chat.” Michael Gordon, a professor at the University of Michigan’s Ross School of Business and faculty director of the Center for Social Impact, said in an interview that “Delta has every right to tell legislators, ‘We’re not of a mind to do your bidding.’ They could easily pack their bags and move away from Atlanta and go to Dallas.” But it seemed unlikely that the airline would move. In 2016, the company signed an airport lease with the city that would keep its headquarters in Atlanta through 2036. Advertisement “Atlanta and Georgia and the business community usually try to work together and Delta is a huge employer in this state,” said another former Atlanta mayor, Shirley Franklin. “So the relationship is damaged, if nothing else.” A broader concern, shared by some liberals, conservatives and members of the Georgia business community, is that gun control may now join other hot-button cultural topics that may damage the state’s reputation among national and global corporations that do not adhere to the same conservative Southern values as the state legislature. In the last few years, the legislature has taken up a number of prominent bills that critics say would allow for discrimination against lesbian, gay, bisexual and transgender people. Gov. Nathan Deal vetoed one of them, a so-called religious liberty bill, in 2016, after some of the state’s most prestigious and powerful companies — including Delta, Home Depot and Coca-Cola — openly opposed the measure. Mr. Deal, a Republican, will soon leave office because of term limits. Mr. Cagle, a leading candidate to replace him, is among a number of Republican hopefuls who say they will continue to support the legislation, which would have strengthened legal protection for opponents of same-sex marriage. Mr. McKoon, a Republican who is leaving the upper chamber to run for secretary of state, said that he had long opposed the jet-fuel tax break on the grounds that it seemed like a handout for a politically connected industry. Mr. McKoon was a vocal supporter of the 2016 religious liberty bill that Mr. Deal vetoed. He said that when that legislation failed, he issued a warning, saying that liberals would continue pressuring companies to embrace progressive social positions. He warned, he said, that “the next logical step would be to attack gun rights. And I think we are seeing the beginning of that.” An earlier version of this article, using information provided by a consulting firm working for Delta Air Lines, misstated the airline’s estimate of its economic impact on Georgia. It is $43.5 billion, not $435 billion. Richard Fausset and Tiffany Hsu on Twitter: @RichardFausset, @tiffkhsu A version of this article appears in print on February 28, 2018, on Page A1 of the New York edition with the headline: N.R.A. Battle Pits Business Against G.O.P. .  Order Reprints| Today's Paper|Subscribe

 We’re interested in your feedback on this page. Tell us what you think. Go to Home Page »",amazon,reviews are negative,1524.5,1526.78,1507.21,1511.98,4808776
